{
  "$schema": "https://json-schema.org/draft/2020-12/schema",
  "$id": "https://can-lang.org/schemas/native-test/1/report",
  "title": "Native-test Can report",
  "description": "Can-authored report wire shape: verification basis plus per-unit admission, execution, behavior, check accounting and body-terminal facts. Sticky mismatches and not-reached checks stay visible; bare ok with missing checks is invalid.",
  "$defs": {
    "id": {
      "type": "string",
      "pattern": "^[A-Za-z0-9][A-Za-z0-9_.:-]{0,127}$"
    },
    "digest": {
      "type": "string",
      "pattern": "^sha256:[0-9a-f]{64}$"
    },
    "check": {
      "type": "object",
      "properties": {
        "check_id": {
          "$ref": "#/$defs/id"
        },
        "disposition": {
          "type": "string",
          "enum": ["matched", "mismatched", "not-reached-after-failure", "missing", "invalid-evidence"]
        }
      },
      "required": ["check_id", "disposition"],
      "additionalProperties": false
    },
    "unit": {
      "type": "object",
      "properties": {
        "case_id": {
          "$ref": "#/$defs/id"
        },
        "variant_id": {
          "$ref": "#/$defs/id"
        },
        "attempt": {
          "type": "integer",
          "minimum": 0,
          "maximum": 1000000
        },
        "admission": {
          "type": "string",
          "enum": ["admitted", "blocked"]
        },
        "admission_reason": {
          "type": "string",
          "minLength": 1,
          "maxLength": 512
        },
        "execution": {
          "type": "string",
          "enum": ["not-started", "running", "completed", "broken", "cancelled"]
        },
        "behavior": {
          "type": "string",
          "enum": ["matched", "mismatched", "undetermined"]
        },
        "checks": {
          "type": "array",
          "items": {
            "$ref": "#/$defs/check"
          }
        },
        "body_terminal": {
          "type": "boolean"
        }
      },
      "required": ["case_id", "attempt", "admission", "execution", "behavior", "checks", "body_terminal"],
      "additionalProperties": false
    }
  },
  "type": "object",
  "properties": {
    "schema_version": {
      "const": "1"
    },
    "run_id": {
      "$ref": "#/$defs/id"
    },
    "plan_digest": {
      "$ref": "#/$defs/digest"
    },
    "mode": {
      "type": "string",
      "enum": ["execute", "list", "plan"]
    },
    "verification": {
      "type": "object",
      "properties": {
        "mode": {
          "type": "string",
          "enum": ["full-roots", "focused-closure", "incomplete"]
        },
        "root_count": {
          "type": "integer",
          "minimum": 0
        },
        "roots_digest": {
          "$ref": "#/$defs/digest"
        }
      },
      "required": ["mode", "root_count", "roots_digest"],
      "additionalProperties": false
    },
    "units": {
      "type": "array",
      "items": {
        "$ref": "#/$defs/unit"
      }
    }
  },
  "required": ["schema_version", "run_id", "plan_digest", "mode", "verification", "units"],
  "additionalProperties": false
}
