{
  "schema_version": "1",
  "run_id": "run-20260930-001",
  "plan_digest": "sha256:8888888888888888888888888888888888888888888888888888888888888888",
  "mode": "execute",
  "verification": {
    "mode": "full-roots",
    "root_count": 12,
    "roots_digest": "sha256:bbbbbbbbbbbbbbbbbbbbbbbbbbbbbbbbbbbbbbbbbbbbbbbbbbbbbbbbbbbbbbbb"
  },
  "units": [
    {
      "case_id": "M01-row-001",
      "variant_id": "bun-darwin-arm64",
      "attempt": 0,
      "admission": "admitted",
      "execution": "completed",
      "behavior": "matched",
      "checks": [
        {
          "check_id": "report-roots-present",
          "disposition": "matched"
        },
        {
          "check_id": "single-build-id",
          "disposition": "matched"
        }
      ],
      "body_terminal": true
    },
    {
      "case_id": "M01-row-002",
      "attempt": 0,
      "admission": "blocked",
      "admission_reason": "missing qualified browser observer on this host",
      "execution": "not-started",
      "behavior": "undetermined",
      "checks": [],
      "body_terminal": false
    }
  ]
}
